{
  "$schema": "https://json-schema.org/draft/2020-12/schema",
  "$id": "anime-noref-clip.story_styles.schema.v1.4.14",
  "title": "Anime No-Ref Clip Story Style Presets",
  "type": "object",
  "required": [
    "schema_version",
    "default_style",
    "style_anchor_base",
    "styles"
  ],
  "properties": {
    "schema_version": {
      "const": "anime-noref-clip.story_styles.v1.4.14"
    },
    "default_style": {
      "type": "string",
      "minLength": 1
    },
    "style_anchor_base": {
      "type": "string",
      "minLength": 1
    },
    "styles": {
      "type": "object",
      "minProperties": 1,
      "additionalProperties": {
        "$ref": "#/$defs/style"
      }
    }
  },
  "additionalProperties": true,
  "$defs": {
    "stringList": {
      "type": "array",
      "items": {
        "type": "string",
        "minLength": 1
      }
    },
    "numberRange": {
      "type": "array",
      "items": {
        "type": "number"
      },
      "minItems": 2,
      "maxItems": 2
    },
    "style": {
      "type": "object",
      "required": [
        "preset_id",
        "label",
        "aliases",
        "use_when",
        "decision_overlay",
        "selection_bias",
        "avoid",
        "script_rules",
        "shot_mapping_rules",
        "creative_qc_profile"
      ],
      "properties": {
        "preset_id": {
          "type": "string",
          "minLength": 1
        },
        "label": {
          "type": "string",
          "minLength": 1
        },
        "aliases": {
          "allOf": [
            {
              "$ref": "#/$defs/stringList"
            },
            {
              "uniqueItems": true
            }
          ]
        },
        "use_when": {
          "$ref": "#/$defs/stringList"
        },
        "decision_overlay": {
          "$ref": "#/$defs/decisionOverlay"
        },
        "selection_bias": {
          "$ref": "#/$defs/stringList"
        },
        "avoid": {
          "$ref": "#/$defs/stringList"
        },
        "script_rules": {
          "$ref": "#/$defs/scriptRules"
        },
        "shot_mapping_rules": {
          "$ref": "#/$defs/shotMappingRules"
        },
        "creative_qc_profile": {
          "$ref": "#/$defs/creativeQcProfile"
        }
      },
      "additionalProperties": true
    },
    "scriptRules": {
      "type": "object",
      "required": [
        "opening",
        "middle",
        "ending",
        "support"
      ],
      "properties": {
        "opening": {
          "type": "string",
          "minLength": 1
        },
        "middle": {
          "type": "string",
          "minLength": 1
        },
        "ending": {
          "type": "string",
          "minLength": 1
        },
        "support": {
          "type": "string",
          "minLength": 1
        }
      },
      "additionalProperties": true
    },
    "shotMappingRules": {
      "type": "object",
      "required": [
        "cold_open",
        "body",
        "unit_binding",
        "replacement",
        "large_jumps"
      ],
      "properties": {
        "cold_open": {
          "type": "string",
          "minLength": 1
        },
        "body": {
          "type": "string",
          "minLength": 1
        },
        "unit_binding": {
          "type": "string",
          "minLength": 1
        },
        "replacement": {
          "type": "string",
          "minLength": 1
        },
        "large_jumps": {
          "type": "string",
          "minLength": 1
        }
      },
      "additionalProperties": true
    },
    "decisionOverlay": {
      "type": "object",
      "required": [
        "retention_mode",
        "hook_strategy",
        "nonlinear_teaser_allowed",
        "max_nonlinear_exceptions",
        "target_duration_sec",
        "script_density",
        "shot_energy",
        "cold_open_max_sec",
        "cold_open_allow_nonlinear",
        "post_hook_main_path",
        "post_hook_min_shot_duration",
        "dialogue_scene_min_shot_duration",
        "target_shot_count_60s",
        "hook_speed_range",
        "post_hook_speed_range",
        "absolute_non_hook_speed_range",
        "clone_padding_policy",
        "alignment_solve_order",
        "cold_open_policy"
      ],
      "properties": {
        "retention_mode": {
          "type": "string",
          "minLength": 1
        },
        "hook_strategy": {
          "type": "string",
          "minLength": 1
        },
        "nonlinear_teaser_allowed": {
          "type": "boolean"
        },
        "max_nonlinear_exceptions": {
          "type": "integer",
          "minimum": 0
        },
        "target_duration_sec": {
          "type": "number",
          "exclusiveMinimum": 0
        },
        "script_density": {
          "type": "string",
          "minLength": 1
        },
        "shot_energy": {
          "type": "string",
          "minLength": 1
        },
        "cold_open_max_sec": {
          "type": "number",
          "minimum": 0
        },
        "cold_open_allow_nonlinear": {
          "type": "boolean"
        },
        "post_hook_main_path": {
          "type": "string",
          "minLength": 1
        },
        "post_hook_min_shot_duration": {
          "type": "number",
          "minimum": 0
        },
        "dialogue_scene_min_shot_duration": {
          "type": "number",
          "minimum": 0
        },
        "target_shot_count_60s": {
          "$ref": "#/$defs/numberRange"
        },
        "hook_speed_range": {
          "$ref": "#/$defs/numberRange"
        },
        "post_hook_speed_range": {
          "$ref": "#/$defs/numberRange"
        },
        "absolute_non_hook_speed_range": {
          "$ref": "#/$defs/numberRange"
        },
        "clone_padding_policy": {
          "type": "string",
          "minLength": 1
        },
        "alignment_solve_order": {
          "type": "string",
          "minLength": 1
        },
        "cold_open_policy": {
          "type": "string",
          "minLength": 1
        }
      },
      "additionalProperties": true
    },
    "creativeQcProfile": {
      "type": "object",
      "required": [
        "min_hook_candidates",
        "unsupported_claims_count",
        "generic_exposition_lines_max",
        "first_3s_requires_subject_and_conflict",
        "rehook_interval_max_sec",
        "cold_open_max_sec",
        "return_to_main_timeline_max_sec",
        "selected_shot_count_60s",
        "post_hook_min_shot_duration_sec",
        "dialogue_scene_min_shot_duration_sec",
        "post_hook_contiguous_source_blocks",
        "unique_shots",
        "op_ed_overlap_count"
      ],
      "properties": {
        "min_hook_candidates": {
          "type": "integer",
          "minimum": 0
        },
        "unsupported_claims_count": {
          "type": "integer",
          "minimum": 0
        },
        "generic_exposition_lines_max": {
          "type": "integer",
          "minimum": 0
        },
        "first_3s_requires_subject_and_conflict": {
          "type": "boolean"
        },
        "rehook_interval_max_sec": {
          "type": "number",
          "minimum": 0
        },
        "cold_open_max_sec": {
          "type": "number",
          "minimum": 0
        },
        "return_to_main_timeline_max_sec": {
          "type": "number",
          "minimum": 0
        },
        "selected_shot_count_60s": {
          "$ref": "#/$defs/numberRange"
        },
        "post_hook_min_shot_duration_sec": {
          "type": "number",
          "minimum": 0
        },
        "dialogue_scene_min_shot_duration_sec": {
          "type": "number",
          "minimum": 0
        },
        "post_hook_contiguous_source_blocks": {
          "type": "boolean"
        },
        "unique_shots": {
          "type": "boolean"
        },
        "op_ed_overlap_count": {
          "type": "integer",
          "minimum": 0
        }
      },
      "additionalProperties": true
    }
  }
}
