{
  "schema_version": "anime-noref-clip.story_styles.v1.4.14",
  "default_style": "style_01_aggressive_youtube_cold_start",
  "style_anchor_base": "references/story_styles.json#styles/",
  "styles": {
    "style_01_aggressive_youtube_cold_start": {
      "preset_id": "style_01_aggressive_youtube_cold_start",
      "label": "Aggressive YouTube Cold Start",
      "aliases": [
        "preset1",
        "style1",
        "cold_start",
        "aggressive",
        "youtube_retention",
        "current_default"
      ],
      "use_when": [
        "YouTube Shorts or similar cold traffic",
        "the first seconds must create a strong reason to keep watching",
        "the source has visible conflict, danger, confession, reversal, choice, consequence, or object clues"
      ],
      "decision_overlay": {
        "retention_mode": "aggressive_youtube_cold_start",
        "hook_strategy": "multi_hook_with_payoff",
        "nonlinear_teaser_allowed": true,
        "max_nonlinear_exceptions": 2,
        "target_duration_sec": 60,
        "script_density": "high",
        "shot_energy": "aggressive_but_stable_after_hook",
        "cold_open_max_sec": 5,
        "cold_open_allow_nonlinear": true,
        "post_hook_main_path": "contiguous_source_blocks",
        "post_hook_min_shot_duration": 1.3,
        "dialogue_scene_min_shot_duration": 1.6,
        "target_shot_count_60s": [
          25,
          35
        ],
        "hook_speed_range": [
          0.75,
          1.35
        ],
        "post_hook_speed_range": [
          0.88,
          1.18
        ],
        "absolute_non_hook_speed_range": [
          0.75,
          1.25
        ],
        "clone_padding_policy": "no_clone_padding_except_final_2_frames",
        "alignment_solve_order": "shot_count_then_speed",
        "cold_open_policy": "allowed_if_supported_and_reviewed"
      },
      "selection_bias": [
        "conflict",
        "danger",
        "confession",
        "emotional reversal",
        "character choice",
        "visible consequence",
        "object clue",
        "strong reaction",
        "visual salience",
        "payoff availability"
      ],
      "avoid": [
        "unsupported hype",
        "invented motive",
        "generic exposition",
        "unrelated filler shots",
        "scattered post-hook single-shot sampling",
        "OP/ED/preview overlap",
        "repeated same-framing close-ups without emotional purpose",
        "post-hook overcutting"
      ],
      "script_rules": {
        "opening": "start with a source-supported conflict, danger, contradiction, confession, or clear question in the first 1-2 seconds",
        "middle": "add supported micro-hooks every 6-10 seconds and pay off or escalate each within 6-15 seconds",
        "ending": "end at the strongest retention point; do not require full episode closure",
        "support": "use only visible action, dialogue, emotion, objects, and transcript/frame-supported relationships"
      },
      "script_style_guide": {
        "tone": "高冲突、快节奏、强留存，但每个刺激点都必须有画面或台词支撑，并在后文给出 payoff 或升级。",
        "sentence_shape": "短句推进；每句话优先制造危险、误会、选择、背叛、后果或反应，避免空泛震惊词。",
        "opening_rotation": [
          "危险逼近",
          "信任破裂",
          "身份暴露",
          "关键选择",
          "物件线索",
          "强反应"
        ],
        "transition_bank": [
          "他刚以为自己安全了",
          "下一秒",
          "但真正的问题是",
          "这不是普通误会",
          "更麻烦的是",
          "而这个选择很快带来后果"
        ],
        "ip_masking": "除非用户明确要求保留，否则公开视频台本默认把作品名、系列名、角色正式名和强识别专有名替换成角色身份、关系、外貌、职业或剧情功能称呼，例如少年、她的同伴、门外的人、黑衣敌人、那名少女。",
        "forbidden_patterns": [
          "没有画面证据的震撼反转",
          "只喊最强、最炸裂却不说明画面事实",
          "连续重复同一种冲突句式",
          "提前泄露没有 payoff 的悬念",
          "未被要求时直接暴露 IP 或正式角色名"
        ],
        "example_lines": [
          "少年刚以为自己逃过一劫，门外的人已经举起了刀。",
          "这不是普通误会，因为下一秒，他最信任的人直接站到了对面。",
          "她刚想解释，身后的同伴却先一步把武器对准了她。",
          "这枚不起眼的吊坠，正好证明了少年一直隐瞒的身份。",
          "危险没有结束，因为黑衣敌人已经堵住了唯一的出口。"
        ],
        "bad_good_examples": [
          {
            "bad": "最震撼的反转来了。",
            "good": "她刚说完这句话，身后的同伴就把武器对准了她。"
          },
          {
            "bad": "这个敌人强到离谱。",
            "good": "黑衣敌人只是抬起手，整扇门就被震得四分五裂。"
          },
          {
            "bad": "少年彻底崩溃了。",
            "good": "少年没有再说话，只是低头看着断掉的刀。"
          }
        ]
      },
      "shot_mapping_rules": {
        "cold_open": "may use up to 5 seconds of fast cuts and at most 2 documented nonlinear exceptions",
        "return_to_main_path": "return to the main source timeline within 6-8 seconds",
        "body": "use 3-6 contiguous source blocks for a 60-second short",
        "unit_binding": "bind each script unit to one small source block or adjacent block pair",
        "replacement": "prefer the nearest later suitable shot in the same story beat",
        "large_jumps": "allow only at beat or paragraph transitions with recorded reasons"
      },
      "creative_qc_profile": {
        "min_hook_candidates": 8,
        "unsupported_claims_count": 0,
        "generic_exposition_lines_max": 1,
        "first_3s_requires_subject_and_conflict": true,
        "rehook_interval_max_sec": 10,
        "cold_open_max_sec": 5,
        "return_to_main_timeline_max_sec": 8,
        "selected_shot_count_60s": [
          25,
          35
        ],
        "post_hook_min_shot_duration_sec": 1.3,
        "dialogue_scene_min_shot_duration_sec": 1.6,
        "post_hook_contiguous_source_blocks": true,
        "unique_shots": true,
        "op_ed_overlap_count": 0
      }
    },
    "style_02_natural_plot_explanation": {
      "preset_id": "style_02_natural_plot_explanation",
      "label": "Natural Plot Explanation",
      "aliases": [
        "preset2",
        "style2",
        "natural",
        "plot",
        "calm_recap",
        "low_risk"
      ],
      "use_when": [
        "the user asks for a calmer recap, chronological explanation, or lower-risk continuity",
        "the source is dialogue-heavy or emotionally quiet",
        "retention should come from clarity and plot causality rather than nonlinear shock"
      ],
      "decision_overlay": {
        "retention_mode": "natural_plot_explanation",
        "hook_strategy": "single_light_hook",
        "nonlinear_teaser_allowed": false,
        "max_nonlinear_exceptions": 0,
        "target_duration_sec": 60,
        "script_density": "moderate",
        "shot_energy": "moderate_continuity_first",
        "cold_open_max_sec": 4,
        "cold_open_allow_nonlinear": false,
        "post_hook_main_path": "contiguous_source_blocks",
        "post_hook_min_shot_duration": 1.6,
        "dialogue_scene_min_shot_duration": 1.8,
        "target_shot_count_60s": [
          18,
          28
        ],
        "hook_speed_range": [
          0.85,
          1.2
        ],
        "post_hook_speed_range": [
          0.9,
          1.12
        ],
        "absolute_non_hook_speed_range": [
          0.85,
          1.18
        ],
        "clone_padding_policy": "no_clone_padding_except_final_2_frames",
        "alignment_solve_order": "shot_count_then_speed",
        "cold_open_policy": "chronological_only_unless_user_approves"
      },
      "selection_bias": [
        "plot causality",
        "clear dialogue",
        "character relationship",
        "reaction",
        "scene continuity",
        "readable emotion"
      ],
      "avoid": [
        "unsupported shock hook",
        "nonlinear spoiler",
        "overcutting",
        "ambiguous character motivation",
        "unrelated filler shots"
      ],
      "script_rules": {
        "opening": "start with a clear source-supported question or situation, not empty sensationalism",
        "middle": "keep events chronological and explain cause-effect relationships compactly",
        "ending": "end at a clear emotional or plot turning point",
        "support": "use only transcript/frame-supported plot relationships"
      },
      "script_style_guide": {
        "tone": "平稳、清楚、可信，重点讲明因果和人物处境，不靠夸张词制造刺激。",
        "sentence_shape": "按事件顺序组织短句；每句话说明一个原因、行动、结果或关系变化。",
        "opening_rotation": [
          "误会起点",
          "当前处境",
          "任务原因",
          "关系变化",
          "关键发现",
          "后果说明"
        ],
        "transition_bank": [
          "事情要从这里说起",
          "因为",
          "所以",
          "直到这时",
          "这也解释了",
          "接下来"
        ],
        "ip_masking": "除非用户明确要求保留，否则公开视频台本默认把作品名、系列名、角色正式名和强识别专有名替换成角色身份、关系、外貌、职业或剧情功能称呼，例如少年、他的同伴、那名少女、村里的医生、负责护送的人。",
        "forbidden_patterns": [
          "把普通因果说成惊天反转",
          "为了留存强行制造不存在的阴谋",
          "跳过必要原因直接讲结果",
          "用过度爽文词破坏清晰度",
          "未被要求时直接暴露 IP 或正式角色名"
        ],
        "example_lines": [
          "事情要从这场误会开始说起。",
          "他不是故意隐瞒，而是一直没有找到解释的机会。",
          "为了保护同伴，他只能先把真相藏起来。",
          "直到那封信被发现，大家才明白他为什么独自离开。",
          "这场争执没有立刻结束，却让两人的目标终于一致。"
        ],
        "bad_good_examples": [
          {
            "bad": "更炸裂的是，他居然做出了惊天决定。",
            "good": "为了保护同伴，他只能先把真相藏起来。"
          },
          {
            "bad": "所有人都被这个超级阴谋震惊了。",
            "good": "大家这才发现，真正的问题不是敌人，而是他们一直误会了彼此。"
          },
          {
            "bad": "他突然开始疯狂行动。",
            "good": "听完解释后，他立刻转身去找那名失踪的同伴。"
          }
        ]
      },
      "shot_mapping_rules": {
        "cold_open": "chronological source opening or a light same-block hook only",
        "return_to_main_path": "nonlinear returns should be unnecessary; if present, user approval is required",
        "body": "use 3-5 contiguous source blocks for a 60-second recap",
        "unit_binding": "bind each script unit to one source block or adjacent pair",
        "replacement": "prefer nearest later suitable shot in the same story beat",
        "large_jumps": "allow only when a new plot beat begins and reason is recorded"
      },
      "creative_qc_profile": {
        "min_hook_candidates": 4,
        "unsupported_claims_count": 0,
        "generic_exposition_lines_max": 2,